{
  "id": "TASK-001",
  "title": "Implement specification for REQ-611",
  "role": "billing-engineer",
  "objective": "Implement Implement specification for REQ-611",
  "domain": "billing",
  "requirements": [
    "REQ-611"
  ],
  "acceptance_criteria": [
    "AC-611.1"
  ],
  "dependencies": [],
  "ownership": {
    "write": [
      "src/modules/req-611/**"
    ]
  },
  "process": {
    "tdd": true,
    "systematic_debugging": true,
    "verification_before_completion": true
  },
  "output": {
    "implementation_report": true,
    "tests": true,
    "commit": true
  },
  "completion": {
    "tests_must_pass": true,
    "no_self_declared_done": true
  }
}